{
  "$schema": "https://json-schema.org/draft/2020-12/schema",
  "$id": "https://github.com/GoogleChrome/chromerootprogram/blob/main/content/cqrp/disclosures/mtc-disclosures.schema.json",
  "title": "MTC CA Operator Disclosures Schema",
  "description": "Schema for MTC CA and Mirroring Operator disclosures supporting per-key and global disclosure URLs.",
  "type": "object",
  "required": [
    "operator_name",
    "last_updated",
    "global_disclosures"
  ],
  "properties": {
    "$schema": {
      "type": "string",
      "format": "uri"
    },
    "operator_name": {
      "type": "string",
      "minLength": 1,
      "description": "Legal name of the Operator."
    },
    "last_updated": {
      "type": "string",
      "format": "date-time",
      "description": "ISO 8601 UTC timestamp indicating when this manifest was last updated."
    },
    "global_disclosures": {
      "type": "object",
      "description": "Operator-wide disclosures applicable across all operations and CA Cosigner Keys.",
      "required": [
        "ca_repository_url",
        "legal_entity_and_ownership_url",
        "operational_status_url"
      ],
      "properties": {
        "ca_repository_url": {
          "type": "string",
          "format": "uri",
          "description": "URL to the Operator's public repository where items like policy documents, Subscriber agreements, certificate profiles, and historical revisions reside."
        },
        "legal_entity_and_ownership_url": {
          "type": "string",
          "format": "uri",
          "description": "URL detailing legal entity status, beneficial ownership, and corporate control."
        },
        "operational_status_url": {
          "type": "string",
          "format": "uri",
          "description": "URL to public operational status reporting pages."
        },
        "facility_certification_url": {
          "type": "string",
          "format": "uri",
          "description": "URL to ISO/IEC 27001, AICPA SOC 2 Type II / SOC 3, or equivalent facility audit certification. Required when applying or operating as an MTC CA Operator."
        }
      },
      "additionalProperties": false
    },
    "ca_cosigner_keys": {
      "type": "array",
      "description": "List of disclosures specific to each CA Cosigner Key included in the CQRS. May be omitted by applicants initially onboarding solely as a Mirroring Operator.",
      "minItems": 1,
      "items": {
        "type": "object",
        "required": [
          "friendly_name",
          "key_sha256",
          "disclosures"
        ],
        "properties": {
          "friendly_name": {
            "type": "string",
            "minLength": 1,
            "description": "Human-readable name for the CA Cosigner Key."
          },
          "key_sha256": {
            "type": "string",
            "pattern": "^[a-fA-F0-9]{64}$",
            "description": "Hex-encoded SHA-256 hash of the CA Cosigner Key's DER-encoded SubjectPublicKeyInfo (SPKI)."
          },
          "disclosures": {
            "type": "object",
            "description": "Key-specific disclosure URLs and CRL Distribution Points.",
            "required": [
              "policy_documents_url",
              "reserve_keys_url",
              "key_generation_attestation_url",
              "infrastructure_architecture_url",
              "full_crl_urls",
              "partitioned_crl_urls"
            ],
            "properties": {
              "policy_documents_url": {
                "type": "string",
                "format": "uri",
                "description": "URL to the Markdown/AsciiDoc combined CP/CPS governing this key."
              },
              "reserve_keys_url": {
                "type": "string",
                "format": "uri",
                "description": "URL disclosing anticipated Reserve CA Cosigner Keys for this key lineage."
              },
              "key_generation_attestation_url": {
                "type": "string",
                "format": "uri",
                "description": "URL to the Key Generation Ceremony Attestation report for this key."
              },
              "infrastructure_architecture_url": {
                "type": "string",
                "format": "uri",
                "description": "URL describing infrastructure architecture and geographic diversity for this key."
              },
              "facility_certification_url": {
                "type": "string",
                "format": "uri",
                "description": "Optional override URL for facility certification if this key is hosted in a distinct facility."
              },
              "full_crl_urls": {
                "type": "array",
                "description": "Array of HTTP URLs for all Full (complete) CRLs issued by this CA Cosigner Key. MUST be an empty array ([]) if this key only issues partitioned CRLs or is an offline Reserve key.",
                "items": {
                  "type": "string",
                  "format": "uri",
                  "pattern": "^http://"
                },
                "uniqueItems": true
              },
              "partitioned_crl_urls": {
                "type": "array",
                "description": "Array of HTTP URLs for all Partitioned CRLs issued by this CA Cosigner Key. MUST be an empty array ([]) if this key only issues full CRLs or is an offline Reserve key.",
                "items": {
                  "type": "string",
                  "format": "uri",
                  "pattern": "^http://"
                },
                "uniqueItems": true
              }
            },
            "additionalProperties": false
          }
        },
        "additionalProperties": false
      }
    }
  },
  "if": {
    "required": [
      "ca_cosigner_keys"
    ]
  },
  "then": {
    "properties": {
      "global_disclosures": {
        "required": [
          "facility_certification_url"
        ]
      }
    }
  },
  "additionalProperties": false
}
